{"audit_trail":[{"actor_ref":"urn:acef:act:573cfa12-9983-5292-8a22-e800a2a2a334","description":"Initial package creation","event_type":"created","timestamp":"2026-06-17T18:04:18Z"}],"entities":{"actors":[],"components":[],"datasets":[{"dataset_id":"urn:acef:dat:c4c49a7f-986e-4524-bfff-0350ca80eb4c","modality":"text","name":"WebCorpus-2025","size":{"records":15000000000,"size_gb":8500},"source_type":"scraped","subject_refs":["urn:acef:sub:34a93a0d-4053-4c78-832e-c5adac90b030"],"version":"1.0"},{"dataset_id":"urn:acef:dat:c0d9a761-b288-44b8-9fd0-5ec5e9f63a20","modality":"text","name":"Licensed-News-Archive","size":{"records":850000000,"size_gb":420},"source_type":"licensed","subject_refs":["urn:acef:sub:34a93a0d-4053-4c78-832e-c5adac90b030"],"version":"3.1"}],"relationships":[{"description":"","relationship_type":"trains_on","source_ref":"urn:acef:sub:34a93a0d-4053-4c78-832e-c5adac90b030","target_ref":"urn:acef:dat:c4c49a7f-986e-4524-bfff-0350ca80eb4c"},{"description":"","relationship_type":"trains_on","source_ref":"urn:acef:sub:34a93a0d-4053-4c78-832e-c5adac90b030","target_ref":"urn:acef:dat:c0d9a761-b288-44b8-9fd0-5ec5e9f63a20"}]},"metadata":{"package_id":"urn:acef:pkg:cfb45b6a-5734-4a44-b94e-0a009a696cfb","producer":{"name":"acef-golden-builder","version":"1.0.0"},"timestamp":"2026-06-17T18:04:18Z"},"profiles":[{"applicable_provisions":["article-53"],"profile_id":"eu-ai-act-2024","template_version":"1.0.0"}],"record_files":[{"count":1,"path":"records/copyright_rights_reservation.jsonl","record_type":"copyright_rights_reservation"},{"count":1,"path":"records/data_provenance.jsonl","record_type":"data_provenance"},{"count":1,"path":"records/evaluation_report.jsonl","record_type":"evaluation_report"},{"count":1,"path":"records/license_record.jsonl","record_type":"license_record"},{"count":1,"path":"records/transparency_disclosure.jsonl","record_type":"transparency_disclosure"}],"subjects":[{"lifecycle_phase":"deployment","lifecycle_timeline":[],"modalities":["text"],"name":"Frontier-LLM-70B","provider":"GenerativeAI Inc","risk_classification":"gpai","subject_id":"urn:acef:sub:34a93a0d-4053-4c78-832e-c5adac90b030","subject_type":"ai_model","version":"2.0.0"}],"versioning":{"core_version":"1.0.0","profiles_version":"1.0.0"}}