{"audit_trail":[{"actor_ref":"urn:acef:act:188af5ed-9796-5533-8f8c-8067abd6683a","description":"Initial package creation","event_type":"created","timestamp":"2026-06-17T18:04:18Z"}],"entities":{"actors":[],"components":[],"datasets":[],"relationships":[]},"metadata":{"package_id":"urn:acef:pkg:04e52f05-c389-47dd-aae9-112846133238","producer":{"name":"acef-test-vector-builder","version":"1.0.0"},"timestamp":"2026-06-17T18:04:18Z"},"profiles":[{"applicable_provisions":["article-9"],"profile_id":"eu-ai-act-2024","template_version":"1.1.0"}],"record_files":[{"count":1,"path":"records/risk_register.jsonl","record_type":"risk_register"},{"count":1,"path":"records/risk_treatment.jsonl","record_type":"risk_treatment"}],"subjects":[{"lifecycle_phase":"development","lifecycle_timeline":[],"modalities":["text"],"name":"MinimalRiskSystem","provider":"TestProvider Inc","risk_classification":"high-risk","subject_id":"urn:acef:sub:74d29331-2aa4-4321-928d-067877b72933","subject_type":"ai_system","version":"1.0.0"}],"versioning":{"core_version":"1.0.0","profiles_version":"1.0.0"}}