{"audit_trail":[{"actor_ref":"urn:acef:act:573cfa12-9983-5292-8a22-e800a2a2a334","description":"Initial package creation","event_type":"created","timestamp":"2026-06-17T18:04:18Z"}],"entities":{"actors":[],"components":[],"datasets":[],"relationships":[]},"metadata":{"package_id":"urn:acef:pkg:a18668f4-37e3-42ef-a0a2-3a82172c6ca2","producer":{"name":"acef-golden-builder","version":"1.0.0"},"timestamp":"2026-06-17T18:04:18Z"},"profiles":[{"applicable_provisions":["cac-explicit-label","cac-implicit-metadata","cac-watermark","cac-log-retention"],"profile_id":"china-cac-labeling-2025","template_version":"1.0.0"}],"record_files":[{"count":1,"path":"records/disclosure_labeling.jsonl","record_type":"disclosure_labeling"},{"count":2,"path":"records/event_log.jsonl","record_type":"event_log"},{"count":2,"path":"records/transparency_marking.jsonl","record_type":"transparency_marking"}],"subjects":[{"lifecycle_phase":"deployment","lifecycle_timeline":[],"modalities":["text","image"],"name":"SmartChat CN","provider":"SinoAI Technology Co., Ltd.","risk_classification":"gpai","subject_id":"urn:acef:sub:bf06e980-8674-432a-b78c-afd102593b97","subject_type":"ai_system","version":"4.0.0"}],"versioning":{"core_version":"1.0.0","profiles_version":"1.0.0"}}