{"audit_trail":[{"actor_ref":"urn:acef:act:573cfa12-9983-5292-8a22-e800a2a2a334","description":"Initial package creation","event_type":"created","timestamp":"2026-06-17T18:04:18Z"}],"entities":{"actors":[],"components":[{"component_id":"urn:acef:cmp:e2bf6542-481a-481c-857c-2198e8bee244","name":"InsightVectorDB","provider":"DataInsight Corp","subject_refs":["urn:acef:sub:7c4d7da9-7a5f-446c-9ee0-f25453c504af","urn:acef:sub:2153c4b4-e012-45ef-a13d-a5cc61d0e649"],"type":"database","version":"3.0.0"},{"component_id":"urn:acef:cmp:d237fcdd-2653-485a-b9aa-0d82d4834999","name":"InsightRetriever","provider":"DataInsight Corp","subject_refs":["urn:acef:sub:7c4d7da9-7a5f-446c-9ee0-f25453c504af"],"type":"retriever","version":"2.5.0"}],"datasets":[{"dataset_id":"urn:acef:dat:536ecb96-64c5-4c53-bb8b-2ffe501e2fee","modality":"text","name":"Enterprise-Corpus-2025","size":{"records":50000000,"size_gb":120},"source_type":"licensed","subject_refs":["urn:acef:sub:2153c4b4-e012-45ef-a13d-a5cc61d0e649"],"version":"1.0"}],"relationships":[{"description":"","relationship_type":"wraps","source_ref":"urn:acef:sub:7c4d7da9-7a5f-446c-9ee0-f25453c504af","target_ref":"urn:acef:sub:2153c4b4-e012-45ef-a13d-a5cc61d0e649"},{"description":"","relationship_type":"calls","source_ref":"urn:acef:sub:7c4d7da9-7a5f-446c-9ee0-f25453c504af","target_ref":"urn:acef:cmp:d237fcdd-2653-485a-b9aa-0d82d4834999"},{"description":"","relationship_type":"calls","source_ref":"urn:acef:cmp:d237fcdd-2653-485a-b9aa-0d82d4834999","target_ref":"urn:acef:cmp:e2bf6542-481a-481c-857c-2198e8bee244"},{"description":"","relationship_type":"trains_on","source_ref":"urn:acef:sub:2153c4b4-e012-45ef-a13d-a5cc61d0e649","target_ref":"urn:acef:dat:536ecb96-64c5-4c53-bb8b-2ffe501e2fee"}]},"metadata":{"package_id":"urn:acef:pkg:89406a5e-337a-434c-b721-7bb00429e4c0","producer":{"name":"acef-golden-builder","version":"1.0.0"},"timestamp":"2026-06-17T18:04:18Z"},"profiles":[{"applicable_provisions":["article-9","article-10","article-11","article-13","article-53"],"profile_id":"eu-ai-act-2024","template_version":"1.0.0"},{"applicable_provisions":["govern-1","map-1","measure-1"],"profile_id":"nist-ai-rmf-1.0","template_version":"1.0.0"}],"record_files":[{"count":1,"path":"records/copyright_rights_reservation.jsonl","record_type":"copyright_rights_reservation"},{"count":1,"path":"records/data_provenance.jsonl","record_type":"data_provenance"},{"count":1,"path":"records/dataset_card.jsonl","record_type":"dataset_card"},{"count":1,"path":"records/evaluation_report.jsonl","record_type":"evaluation_report"},{"count":1,"path":"records/governance_policy.jsonl","record_type":"governance_policy"},{"count":1,"path":"records/risk_register.jsonl","record_type":"risk_register"},{"count":1,"path":"records/risk_treatment.jsonl","record_type":"risk_treatment"},{"count":1,"path":"records/transparency_disclosure.jsonl","record_type":"transparency_disclosure"}],"subjects":[{"lifecycle_phase":"deployment","lifecycle_timeline":[],"modalities":["text","multimodal"],"name":"InsightAnalytics Platform","provider":"DataInsight Corp","risk_classification":"high-risk","subject_id":"urn:acef:sub:7c4d7da9-7a5f-446c-9ee0-f25453c504af","subject_type":"ai_system","version":"4.0.0"},{"lifecycle_phase":"deployment","lifecycle_timeline":[],"modalities":["text"],"name":"InsightBERT-Large","provider":"DataInsight Corp","risk_classification":"gpai","subject_id":"urn:acef:sub:2153c4b4-e012-45ef-a13d-a5cc61d0e649","subject_type":"ai_model","version":"2.0.0"}],"versioning":{"core_version":"1.0.0","profiles_version":"1.0.0"}}