{"audit_trail":[{"actor_ref":"urn:acef:act:188af5ed-9796-5533-8f8c-8067abd6683a","description":"Initial package creation","event_type":"created","timestamp":"2026-06-17T18:04:18Z"}],"entities":{"actors":[],"components":[],"datasets":[],"relationships":[]},"metadata":{"package_id":"urn:acef:pkg:ca16a474-eee1-488c-a86b-92e4acbf2243","producer":{"name":"acef-test-vector-builder","version":"1.0.0"},"timestamp":"2026-06-17T18:04:18Z"},"profiles":[{"applicable_provisions":["article-9","article-53"],"profile_id":"eu-ai-act-2024","template_version":"1.0.0"}],"record_files":[{"count":1,"path":"records/copyright_rights_reservation.jsonl","record_type":"copyright_rights_reservation"},{"count":1,"path":"records/data_provenance.jsonl","record_type":"data_provenance"},{"count":1,"path":"records/risk_register.jsonl","record_type":"risk_register"},{"count":1,"path":"records/risk_treatment.jsonl","record_type":"risk_treatment"}],"subjects":[{"lifecycle_phase":"development","lifecycle_timeline":[],"modalities":["text"],"name":"MultiSubSys","provider":"TestProvider Inc","risk_classification":"high-risk","subject_id":"urn:acef:sub:3b412cb9-1da1-4c5a-aad7-d7f7cd92036c","subject_type":"ai_system","version":"1.0.0"},{"lifecycle_phase":"development","lifecycle_timeline":[],"modalities":["text"],"name":"MultiSubModel","provider":"TestProvider Inc","risk_classification":"gpai","subject_id":"urn:acef:sub:f032c08d-8305-4622-a7d2-ce34554a39fb","subject_type":"ai_model","version":"1.0.0"}],"versioning":{"core_version":"1.0.0","profiles_version":"1.0.0"}}