{"audit_trail":[{"actor_ref":"urn:acef:act:188af5ed-9796-5533-8f8c-8067abd6683a","description":"Initial package creation","event_type":"created","timestamp":"2026-06-17T18:04:18Z"}],"entities":{"actors":[],"components":[],"datasets":[{"dataset_id":"urn:acef:dat:58089a10-1a94-4d5a-831e-3fad9e6d9fb3","modality":"tabular","name":"NISTTrainData","size":{"records":0,"size_gb":0},"source_type":"licensed","subject_refs":["urn:acef:sub:2ecb679e-6e02-4388-afa7-638a0a19aa17"],"version":"1.0.0"}],"relationships":[]},"metadata":{"package_id":"urn:acef:pkg:7e476e4d-7c4b-4712-aff5-e4b4634ee92d","producer":{"name":"acef-test-vector-builder","version":"1.0.0"},"timestamp":"2026-06-17T18:04:18Z"},"profiles":[{"applicable_provisions":["govern-1","map-1","map-2","measure-1","manage-1","manage-4"],"profile_id":"nist-ai-rmf-1.0","template_version":"1.0.0"}],"record_files":[{"count":1,"path":"records/data_provenance.jsonl","record_type":"data_provenance"},{"count":1,"path":"records/dataset_card.jsonl","record_type":"dataset_card"},{"count":1,"path":"records/evaluation_report.jsonl","record_type":"evaluation_report"},{"count":1,"path":"records/governance_policy.jsonl","record_type":"governance_policy"},{"count":1,"path":"records/incident_report.jsonl","record_type":"incident_report"},{"count":1,"path":"records/risk_register.jsonl","record_type":"risk_register"},{"count":1,"path":"records/risk_treatment.jsonl","record_type":"risk_treatment"}],"subjects":[{"lifecycle_phase":"development","lifecycle_timeline":[],"modalities":["text"],"name":"NISTPlatform","provider":"TestProvider Inc","risk_classification":"high-risk","subject_id":"urn:acef:sub:2ecb679e-6e02-4388-afa7-638a0a19aa17","subject_type":"ai_system","version":"1.0.0"}],"versioning":{"core_version":"1.0.0","profiles_version":"1.0.0"}}