{"audit_trail":[{"actor_ref":"urn:acef:act:188af5ed-9796-5533-8f8c-8067abd6683a","description":"Initial package creation","event_type":"created","timestamp":"2026-06-17T18:04:18Z"}],"entities":{"actors":[],"components":[],"datasets":[],"relationships":[]},"metadata":{"package_id":"urn:acef:pkg:d8b26709-f543-4b2e-af94-f278b00e01b1","producer":{"name":"acef-test-vector-builder","version":"1.0.0"},"timestamp":"2026-06-17T18:04:18Z"},"profiles":[{"applicable_provisions":["article-50.2"],"profile_id":"eu-ai-act-2024","template_version":"1.1.0"}],"record_files":[{"count":1,"path":"records/transparency_marking.jsonl","record_type":"transparency_marking"}],"subjects":[{"lifecycle_phase":"development","lifecycle_timeline":[],"modalities":["image"],"name":"MarkedSystem","provider":"TestProvider Inc","risk_classification":"limited-risk","subject_id":"urn:acef:sub:debad32e-e174-466e-81ca-1c261d68344c","subject_type":"ai_system","version":"1.0.0"}],"versioning":{"core_version":"1.0.0","profiles_version":"1.0.0"}}