{"audit_trail":[{"actor_ref":"urn:acef:act:188af5ed-9796-5533-8f8c-8067abd6683a","description":"Initial package creation","event_type":"created","timestamp":"2026-06-17T18:04:18Z"}],"entities":{"actors":[],"components":[],"datasets":[],"relationships":[]},"metadata":{"package_id":"urn:acef:pkg:d112cdd3-914e-4c15-8920-e10ea7c5b6ce","producer":{"name":"acef-test-vector-builder","version":"1.0.0"},"timestamp":"2026-06-17T18:04:18Z"},"profiles":[{"applicable_provisions":["cac-explicit-label","cac-implicit-metadata","cac-watermark","cac-log-retention"],"profile_id":"china-cac-labeling-2025","template_version":"1.0.0"}],"record_files":[{"count":1,"path":"records/disclosure_labeling.jsonl","record_type":"disclosure_labeling"},{"count":1,"path":"records/event_log.jsonl","record_type":"event_log"},{"count":1,"path":"records/transparency_marking.jsonl","record_type":"transparency_marking"}],"subjects":[{"lifecycle_phase":"development","lifecycle_timeline":[],"modalities":["text"],"name":"CACCompliantSystem","provider":"TestProvider Inc","risk_classification":"gpai","subject_id":"urn:acef:sub:385e7835-fd9a-4345-8392-1a10602d7262","subject_type":"ai_system","version":"1.0.0"}],"versioning":{"core_version":"1.0.0","profiles_version":"1.0.0"}}