{"audit_trail":[{"actor_ref":"urn:acef:act:188af5ed-9796-5533-8f8c-8067abd6683a","description":"Initial package creation","event_type":"created","timestamp":"2026-06-17T18:04:18Z"}],"entities":{"actors":[{"actor_id":"urn:acef:act:406ee9a7-bc37-4005-8c31-59e69a95a6aa","name":"Dr. Sarah Chen","organization":"US Federal Agency","role":"provider"}],"components":[],"datasets":[],"relationships":[]},"metadata":{"package_id":"urn:acef:pkg:2f95873f-b97d-4b4a-84ab-bab78acb9af6","producer":{"name":"acef-test-vector-builder","version":"1.0.0"},"timestamp":"2026-06-17T18:04:18Z"},"profiles":[{"applicable_provisions":["omb-inventory","omb-caio","omb-rights-safety","omb-governance"],"profile_id":"us-omb-m-24-10","template_version":"1.0.0"}],"record_files":[{"count":2,"path":"records/governance_policy.jsonl","record_type":"governance_policy"}],"subjects":[{"lifecycle_phase":"deployment","lifecycle_timeline":[],"modalities":["text"],"name":"FederalBenefitsClassifier","provider":"US Federal Agency","risk_classification":"high-risk","subject_id":"urn:acef:sub:a2108281-5afd-4c20-880e-0fd3ebadf961","subject_type":"ai_system","version":"1.0.0"}],"versioning":{"core_version":"1.0.0","profiles_version":"1.0.0"}}