{"audit_trail":[{"actor_ref":"","description":"Initial package creation","event_type":"created","timestamp":"2026-08-10T00:00:00Z"}],"entities":{"actors":[],"components":[],"datasets":[],"relationships":[]},"metadata":{"package_id":"urn:acef:pkg:00000000-0000-0000-0000-000000000001","producer":{"name":"acef-stix-vector","version":"1.1.0"},"timestamp":"2026-08-10T00:00:00Z"},"profiles":[{"applicable_provisions":["art-73"],"profile_id":"eu-ai-act-art73-2026","template_version":"1.0.0"}],"record_files":[{"count":1,"path":"records/incident_card.jsonl","record_type":"incident_card"}],"subjects":[{"lifecycle_phase":"development","lifecycle_timeline":[],"modalities":["text"],"name":"Sys","provider":"","risk_classification":"high-risk","subject_id":"urn:acef:sub:00000000-0000-0000-0000-000000000002","subject_type":"ai_system","version":"1.0.0"}],"versioning":{"core_version":"1.1.0","profiles_version":"1.0.0"}}