{"audit_trail":[{"actor_ref":"urn:acef:act:188af5ed-9796-5533-8f8c-8067abd6683a","description":"Initial package creation","event_type":"created","timestamp":"2026-06-17T18:04:18Z"}],"entities":{"actors":[],"components":[],"datasets":[],"relationships":[]},"metadata":{"package_id":"urn:acef:pkg:eb3d9ab0-0d30-4ac3-8b68-88182c1c0c14","producer":{"name":"acef-test-vector-builder","version":"1.0.0"},"timestamp":"2026-06-17T18:04:18Z"},"profiles":[{"applicable_provisions":["article-12"],"profile_id":"eu-ai-act-2024","template_version":"1.0.0"}],"record_files":[{"count":2,"path":"records/event_log.jsonl","record_type":"event_log"}],"subjects":[{"lifecycle_phase":"development","lifecycle_timeline":[],"modalities":["text"],"name":"LoggedSystem","provider":"TestProvider Inc","risk_classification":"high-risk","subject_id":"urn:acef:sub:c9734c17-8a1f-4991-9db8-eae12c9992c4","subject_type":"ai_system","version":"1.0.0"}],"versioning":{"core_version":"1.0.0","profiles_version":"1.0.0"}}