{"audit_trail":[{"actor_ref":"urn:acef:act:188af5ed-9796-5533-8f8c-8067abd6683a","description":"Initial package creation","event_type":"created","timestamp":"2026-06-17T18:04:18Z"}],"entities":{"actors":[],"components":[],"datasets":[],"relationships":[]},"metadata":{"package_id":"urn:acef:pkg:6695e41b-97d1-43a5-9902-f2d24968c968","producer":{"name":"acef-test-vector-builder","version":"1.0.0"},"timestamp":"2026-06-17T18:04:18Z"},"profiles":[{"applicable_provisions":["article-9"],"profile_id":"eu-ai-act-2024","template_version":"1.1.0"}],"record_files":[{"count":1,"path":"records/risk_register.jsonl","record_type":"risk_register"},{"count":1,"path":"records/risk_treatment.jsonl","record_type":"risk_treatment"}],"subjects":[{"lifecycle_phase":"development","lifecycle_timeline":[],"modalities":["text"],"name":"ReviewedSystem","provider":"TestProvider Inc","risk_classification":"high-risk","subject_id":"urn:acef:sub:3e157357-bd24-4741-b596-3f7750ff06ac","subject_type":"ai_system","version":"1.0.0"}],"versioning":{"core_version":"1.0.0","profiles_version":"1.0.0"}}