{"audit_trail":[{"actor_ref":"urn:acef:act:573cfa12-9983-5292-8a22-e800a2a2a334","description":"Initial package creation","event_type":"created","timestamp":"2026-06-17T18:04:18Z"}],"entities":{"actors":[{"actor_id":"urn:acef:act:34c2a875-4e46-41bf-9ffa-7c65582baa73","name":"Dr. Elena Vasquez","organization":"HealthAI Corp","role":"provider"},{"actor_id":"urn:acef:act:d240308a-be7b-4e49-8f1c-85b6be5e637f","name":"Berlin University Hospital","organization":"Charite Universitaetsmedizin Berlin","role":"deployer"}],"components":[{"component_id":"urn:acef:cmp:7fec0eee-608d-499c-98da-bdbf9a3e4c47","name":"ClinicalBERT-v3","provider":"HealthAI Corp","subject_refs":["urn:acef:sub:c348092c-4025-4af0-b15d-9a483c364c95"],"type":"model","version":"3.2.0"},{"component_id":"urn:acef:cmp:02718130-1d39-4584-806b-ff7e7d1f3d38","name":"SafetyGuardrail","provider":"HealthAI Corp","subject_refs":["urn:acef:sub:c348092c-4025-4af0-b15d-9a483c364c95"],"type":"guardrail","version":"1.5.0"}],"datasets":[{"dataset_id":"urn:acef:dat:aec36528-4076-43ca-b916-f33b85e939d9","modality":"tabular","name":"MIMIC-IV-Clinical-Subset","size":{"records":524000,"size_gb":12.4},"source_type":"licensed","subject_refs":["urn:acef:sub:c348092c-4025-4af0-b15d-9a483c364c95"],"version":"2.0"}],"relationships":[{"description":"System wraps ClinicalBERT-v3 transformer model","relationship_type":"wraps","source_ref":"urn:acef:sub:c348092c-4025-4af0-b15d-9a483c364c95","target_ref":"urn:acef:cmp:7fec0eee-608d-499c-98da-bdbf9a3e4c47"},{"description":"Model trained on MIMIC-IV clinical dataset","relationship_type":"trains_on","source_ref":"urn:acef:cmp:7fec0eee-608d-499c-98da-bdbf9a3e4c47","target_ref":"urn:acef:dat:aec36528-4076-43ca-b916-f33b85e939d9"},{"description":"Deployer oversees system in clinical environment","relationship_type":"oversees","source_ref":"urn:acef:act:d240308a-be7b-4e49-8f1c-85b6be5e637f","target_ref":"urn:acef:sub:c348092c-4025-4af0-b15d-9a483c364c95"}]},"metadata":{"package_id":"urn:acef:pkg:d735866b-40d5-4ccf-9ef3-8cf0c077cd9f","producer":{"name":"acef-golden-builder","version":"1.0.0"},"timestamp":"2026-06-17T18:04:18Z"},"profiles":[{"applicable_provisions":["article-9","article-10","article-11","article-12","article-13","article-14","article-15","article-17"],"profile_id":"eu-ai-act-2024","template_version":"1.0.0"}],"record_files":[{"count":1,"path":"records/data_provenance.jsonl","record_type":"data_provenance"},{"count":1,"path":"records/dataset_card.jsonl","record_type":"dataset_card"},{"count":1,"path":"records/evaluation_report.jsonl","record_type":"evaluation_report"},{"count":2,"path":"records/event_log.jsonl","record_type":"event_log"},{"count":1,"path":"records/governance_policy.jsonl","record_type":"governance_policy"},{"count":1,"path":"records/human_oversight_action.jsonl","record_type":"human_oversight_action"},{"count":2,"path":"records/risk_register.jsonl","record_type":"risk_register"},{"count":1,"path":"records/risk_treatment.jsonl","record_type":"risk_treatment"},{"count":1,"path":"records/transparency_disclosure.jsonl","record_type":"transparency_disclosure"}],"subjects":[{"lifecycle_phase":"deployment","lifecycle_timeline":[{"phase":"design","start_date":"2024-01-15"},{"phase":"development","start_date":"2024-04-01"},{"phase":"testing","start_date":"2025-06-01"},{"phase":"deployment","start_date":"2025-12-01"}],"modalities":["text","multimodal"],"name":"MedAssist Clinical Decision Support System","provider":"HealthAI Corp","risk_classification":"high-risk","subject_id":"urn:acef:sub:c348092c-4025-4af0-b15d-9a483c364c95","subject_type":"ai_system","version":"3.2.0"}],"versioning":{"core_version":"1.0.0","profiles_version":"1.0.0"}}