{"audit_trail":[],"entities":{"actors":[],"components":[],"datasets":[],"relationships":[]},"metadata":{"package_id":"urn:acef:pkg:00000000-0000-0000-0000-000000000000","producer":{"name":"acef-incident-vectors","version":"1.1.0"},"timestamp":"2026-08-01T00:00:00Z"},"profiles":[],"record_files":[{"count":1,"path":"records/incident_report.jsonl","record_type":"incident_report"}],"subjects":[{"lifecycle_phase":"deployment","lifecycle_timeline":[],"modalities":["text"],"name":"Vector Subject","provider":"ACEF Conformance","risk_classification":"high-risk","subject_id":"urn:acef:sub:00000000-0000-0000-0000-000000000000","subject_type":"ai_system","version":"1.0.0"}],"versioning":{"core_version":"1.1.0","profiles_version":"1.0.0"}}