{"audit_trail":[{"actor_ref":"urn:acef:act:188af5ed-9796-5533-8f8c-8067abd6683a","description":"Initial package creation","event_type":"created","timestamp":"2026-06-17T18:04:18Z"}],"entities":{"actors":[],"components":[],"datasets":[{"dataset_id":"urn:acef:dat:412116f1-f0b3-4d35-933d-3f9fdea6787c","modality":"text","name":"TrainingData","size":{"records":0,"size_gb":0},"source_type":"scraped","subject_refs":["urn:acef:sub:180156a1-4df2-49d5-add6-5052b324928b"],"version":"1.0.0"}],"relationships":[]},"metadata":{"package_id":"urn:acef:pkg:4f03f6ec-a28f-4cea-b7ec-ca4432a8dd89","producer":{"name":"acef-test-vector-builder","version":"1.0.0"},"timestamp":"2026-06-17T18:04:18Z"},"profiles":[{"applicable_provisions":["article-53"],"profile_id":"eu-ai-act-2024","template_version":"1.0.0"}],"record_files":[{"count":1,"path":"records/copyright_rights_reservation.jsonl","record_type":"copyright_rights_reservation"},{"count":1,"path":"records/data_provenance.jsonl","record_type":"data_provenance"},{"count":1,"path":"records/evaluation_report.jsonl","record_type":"evaluation_report"}],"subjects":[{"lifecycle_phase":"development","lifecycle_timeline":[],"modalities":["text"],"name":"GPAIModel","provider":"TestProvider Inc","risk_classification":"gpai","subject_id":"urn:acef:sub:180156a1-4df2-49d5-add6-5052b324928b","subject_type":"ai_model","version":"1.0.0"}],"versioning":{"core_version":"1.0.0","profiles_version":"1.0.0"}}