{"audit_trail":[{"actor_ref":"urn:acef:act:188af5ed-9796-5533-8f8c-8067abd6683a","description":"Initial package creation","event_type":"created","timestamp":"2026-06-17T18:04:18Z"}],"entities":{"actors":[],"components":[],"datasets":[{"dataset_id":"urn:acef:dat:33b8d148-35f8-4761-92b3-e952bc123066","modality":"text","name":"WebTrainingCorpus","size":{"records":5000000000,"size_gb":2400},"source_type":"scraped","subject_refs":["urn:acef:sub:1e8a36be-58ac-4c49-80c9-153b04302630"],"version":"1.0.0"},{"dataset_id":"urn:acef:dat:6329142f-d059-4b1c-af95-eae58344014c","modality":"text","name":"LicensedNewsArchive","size":{"records":500000000,"size_gb":200},"source_type":"licensed","subject_refs":["urn:acef:sub:1e8a36be-58ac-4c49-80c9-153b04302630"],"version":"1.0.0"}],"relationships":[{"description":"","relationship_type":"trains_on","source_ref":"urn:acef:sub:1e8a36be-58ac-4c49-80c9-153b04302630","target_ref":"urn:acef:dat:33b8d148-35f8-4761-92b3-e952bc123066"},{"description":"","relationship_type":"trains_on","source_ref":"urn:acef:sub:1e8a36be-58ac-4c49-80c9-153b04302630","target_ref":"urn:acef:dat:6329142f-d059-4b1c-af95-eae58344014c"}]},"metadata":{"package_id":"urn:acef:pkg:c2280927-d17d-46b0-93e1-b73c4aae9f33","producer":{"name":"acef-test-vector-builder","version":"1.0.0"},"timestamp":"2026-06-17T18:04:18Z"},"profiles":[{"applicable_provisions":["gpai-transparency-1","gpai-transparency-2","gpai-copyright-1","gpai-copyright-2"],"profile_id":"eu-gpai-code-of-practice-2025","template_version":"1.0.0"}],"record_files":[{"count":1,"path":"records/copyright_rights_reservation.jsonl","record_type":"copyright_rights_reservation"},{"count":1,"path":"records/data_provenance.jsonl","record_type":"data_provenance"},{"count":1,"path":"records/license_record.jsonl","record_type":"license_record"}],"subjects":[{"lifecycle_phase":"deployment","lifecycle_timeline":[],"modalities":["text"],"name":"GPAICoPModel","provider":"EUModelProvider Inc","risk_classification":"gpai","subject_id":"urn:acef:sub:1e8a36be-58ac-4c49-80c9-153b04302630","subject_type":"ai_model","version":"1.0.0"}],"versioning":{"core_version":"1.0.0","profiles_version":"1.0.0"}}