{"audit_trail":[{"actor_ref":"urn:acef:act:573cfa12-9983-5292-8a22-e800a2a2a334","description":"Initial package creation","event_type":"created","timestamp":"2026-06-17T18:04:18Z"}],"entities":{"actors":[],"components":[],"datasets":[],"relationships":[]},"metadata":{"package_id":"urn:acef:pkg:fc12b81e-b323-4219-8f6e-34bb2de3300c","producer":{"name":"acef-golden-builder","version":"1.0.0"},"timestamp":"2026-06-17T18:04:18Z"},"profiles":[{"applicable_provisions":["article-50.2"],"profile_id":"eu-ai-act-2024","template_version":"1.1.0"}],"record_files":[{"count":1,"path":"records/disclosure_labeling.jsonl","record_type":"disclosure_labeling"},{"count":1,"path":"records/evaluation_report.jsonl","record_type":"evaluation_report"},{"count":1,"path":"records/event_log.jsonl","record_type":"event_log"},{"count":2,"path":"records/transparency_marking.jsonl","record_type":"transparency_marking"}],"subjects":[{"lifecycle_phase":"deployment","lifecycle_timeline":[],"modalities":["image","video","text"],"name":"ContentGen Studio","provider":"SynthMedia Corp","risk_classification":"limited-risk","subject_id":"urn:acef:sub:246763ee-a955-4a49-8e77-64056e4202c0","subject_type":"ai_system","version":"5.0.0"}],"versioning":{"core_version":"1.0.0","profiles_version":"1.0.0"}}