{"audit_trail":[{"actor_ref":"urn:acef:act:573cfa12-9983-5292-8a22-e800a2a2a334","description":"Initial package creation","event_type":"created","timestamp":"2026-06-17T18:04:18Z"}],"entities":{"actors":[],"components":[],"datasets":[],"relationships":[]},"metadata":{"package_id":"urn:acef:pkg:e9368585-54bd-4911-a640-eac84b0a9ca5","producer":{"name":"acef-golden-builder","version":"1.0.0"},"timestamp":"2026-06-17T18:04:18Z"},"profiles":[{"applicable_provisions":["govern-1","map-1","measure-1","manage-1"],"profile_id":"nist-ai-rmf-1.0","template_version":"1.0.0"}],"record_files":[{"count":1,"path":"records/evaluation_report.jsonl","record_type":"evaluation_report"},{"count":2,"path":"records/governance_policy.jsonl","record_type":"governance_policy"},{"count":1,"path":"records/risk_register.jsonl","record_type":"risk_register"},{"count":1,"path":"records/risk_treatment.jsonl","record_type":"risk_treatment"}],"subjects":[{"lifecycle_phase":"deployment","lifecycle_timeline":[],"modalities":["text","multimodal"],"name":"FedBenefitsAssist","provider":"Federal Benefits Administration","risk_classification":"high-risk","subject_id":"urn:acef:sub:1ff22ed2-7b96-458b-a843-95c7532f523b","subject_type":"ai_system","version":"2.1.0"}],"versioning":{"core_version":"1.0.0","profiles_version":"1.0.0"}}